
{
	"request_id": "052003fa-68e4-46bf-a647-c1bd911901d6",
	"query": "executive impersonation wire transfer",
	"processing_time_ms": 2664,
	"total_results": 5,
	"results": [
		{
			"email": {
				"id": "35e2712f-6738-4083-8a1b-6ff00126762e",
				"sender": "cfo@account-alert.net",
				"sender_domain": "account-alert.net",
				"recipient": "unknown@example.com",
				"subject": "ASAP: Wire Transfer Authorization",
				"body": "I'm in meetings all day but need you to process a $15,126 wire transfer ASAP. Same vendor as usual. Handle this quietly.\n\nThanks,\nDavid Martinez\nCFO",
				"timestamp": "2025-10-29T21:02:00",
				"attachments": [],
				"attachment_count": 0,
				"is_phishing": true,
				"phishing_type": null,
				"confidence": null,
				"created_at": "2025-11-13T10:13:03.377749"
			},
			"rank": 1,
			"threat_score": 0.46550127935409538,
			"threat_level": "MEDIUM",
			"confidence": 0.638,
			"search_score": 0.1305626630783081,
			"keyword_matches": [
				"transfer",
				"wire"
			],
			"semantic_similarity": 1.0,
			"features": {
				"urgent_language": 0.7,
				"suspicious_language": 0.0,
				"executive_impersonation": 1.0,
				"new_sender": 0.0,
				"domain_suspicious": 0.0,
				"suspicious_attachment": 0.0,
				"executable_attachment": 0.0,
				"financial_request": 0.6,
				"credential_harvest": 0.0,
				"link_suspicious": 0.0,
				"outside_hours": 0.4,
				"extraction_timestamp": "2025-11-13T10:13:03.380959",
				"overall_risk_score": 0.7545454545454545
			},
			"explanation": "Overview:\n- Threat Level: MEDIUM (0.466)\n- Similarity=0.131 | Confidence: 0.638 | Rank: 1\n\nKey Indicators:\n- executive_impersonation 1.0 – Appears to mimic an executive or authority\n- urgent_language 0.7 – Urgent wording requesting immediate action\n- financial_request 0.6 – Payment / transfer instructions present\n- outside_hours 0.4 – Sent outside typical business hours\n\nRisk Summary:\n- Financial request coupled with urgency signals potential payment fraud; Possible executive impersonation (business email compromise pattern)\n\nRecommended Action:\n- Verify sender authenticity and scrutinize any financial or credential requests.\n\nAnalysis Detail:\n⚠️ HIGH RISK INDICATORS:\n  • Potential executive impersonation detected (confidence: 100.0%)\n  • Contains urgent language requiring immediate action (confidence: 70.0%)\n  • Requests financial information or transactions (confidence: 60.0%)\n\n⚡ MODERATE RISK INDICATORS:\n  • Sent outside typical business hours (confidence: 40.0%)\n\nEmail from: cfo@account-alert.net\nSubject: ASAP: Wire Transfer Authorization...",
			"explanation_structured": {
				"overview": {
					"threat_level": "MEDIUM",
					"threat_score": 0.466,
					"similarity_raw": 0.131,
					"similarity_norm": null,
					"confidence": 0.638,
					"rank": 1
				},
				"indicators": [
					{
						"name": "executive_impersonation",
						"score": 1.0,
						"interpretation": "Appears to mimic an executive or authority"
					},
					{
						"name": "urgent_language",
						"score": 0.7,
						"interpretation": "Urgent wording requesting immediate action"
					},
					{
						"name": "financial_request",
						"score": 0.6,
						"interpretation": "Payment / transfer instructions present"
					},
					{
						"name": "outside_hours",
						"score": 0.4,
						"interpretation": "Sent outside typical business hours"
					}
				],
				"risk_summary": "Financial request coupled with urgency signals potential payment fraud; Possible executive impersonation (business email compromise pattern)",
				"recommended_action": "Verify sender authenticity and scrutinize any financial or credential requests.",
				"analysis_detail": "⚠️ HIGH RISK INDICATORS:\n  • Potential executive impersonation detected (confidence: 100.0%)\n  • Contains urgent language requiring immediate action (confidence: 70.0%)\n  • Requests financial information or transactions (confidence: 60.0%)\n\n⚡ MODERATE RISK INDICATORS:\n  • Sent outside typical business hours (confidence: 40.0%)\n\nEmail from: cfo@account-alert.net\nSubject: ASAP: Wire Transfer Authorization..."
			},
			"processing_time_ms": null
		},
		{
			"email": {
				"id": "2366c11a-1273-4434-9be5-32928f120d1e",
				"sender": "emily.rodriguez@enterprize.org",
				"sender_domain": "enterprize.org",
				"recipient": "unknown@example.com",
				"subject": "ASAP: Wire Transfer Authorization",
				"body": "Hi,\n\nI need you to process an urgent wire transfer today. Client payment of $26,856 needs to go out immediately.\n\nPlease handle this confidentially and let me know when complete.\n\nThanks,\nLisa Davis\nCEO",
				"timestamp": "2025-11-07T10:53:00",
				"attachments": [],
				"attachment_count": 0,
				"is_phishing": true,
				"phishing_type": null,
				"confidence": null,
				"created_at": "2025-11-13T10:13:03.378347"
			},
			"rank": 2,
			"threat_score": 0.4872814030647277,
			"threat_level": "MEDIUM",
			"confidence": 0.611,
			"search_score": 0.08489668369293213,
			"keyword_matches": [
				"transfer",
				"wire"
			],
			"semantic_similarity": 0.65,
			"features": {
				"urgent_language": 0.7,
				"suspicious_language": 0.0,
				"executive_impersonation": 1.0,
				"new_sender": 0.0,
				"domain_suspicious": 0.0,
				"suspicious_attachment": 0.0,
				"executable_attachment": 0.0,
				"financial_request": 0.6,
				"credential_harvest": 0.0,
				"link_suspicious": 0.0,
				"outside_hours": 0.0,
				"extraction_timestamp": "2025-11-13T10:13:03.381582",
				"overall_risk_score": 0.79
			},
			"explanation": "Overview:\n- Threat Level: MEDIUM (0.487)\n- Similarity=0.085 | Confidence: 0.611 | Rank: 2\n\nKey Indicators:\n- executive_impersonation 1.0 – Appears to mimic an executive or authority\n- urgent_language 0.7 – Urgent wording requesting immediate action\n- financial_request 0.6 – Payment / transfer instructions present\n\nRisk Summary:\n- Financial request coupled with urgency signals potential payment fraud; Possible executive impersonation (business email compromise pattern)\n\nRecommended Action:\n- Verify sender authenticity and scrutinize any financial or credential requests.\n\nAnalysis Detail:\n⚠️ HIGH RISK INDICATORS:\n  • Potential executive impersonation detected (confidence: 100.0%)\n  • Contains urgent language requiring immediate action (confidence: 70.0%)\n  • Requests financial information or transactions (confidence: 60.0%)\n\nEmail from: emily.rodriguez@enterprize.org\nSubject: ASAP: Wire Transfer Authorization...",
			"explanation_structured": {
				"overview": {
					"threat_level": "MEDIUM",
					"threat_score": 0.487,
					"similarity_raw": 0.085,
					"similarity_norm": null,
					"confidence": 0.611,
					"rank": 2
				},
				"indicators": [
					{
						"name": "executive_impersonation",
						"score": 1.0,
						"interpretation": "Appears to mimic an executive or authority"
					},
					{
						"name": "urgent_language",
						"score": 0.7,
						"interpretation": "Urgent wording requesting immediate action"
					},
					{
						"name": "financial_request",
						"score": 0.6,
						"interpretation": "Payment / transfer instructions present"
					}
				],
				"risk_summary": "Financial request coupled with urgency signals potential payment fraud; Possible executive impersonation (business email compromise pattern)",
				"recommended_action": "Verify sender authenticity and scrutinize any financial or credential requests.",
				"analysis_detail": "⚠️ HIGH RISK INDICATORS:\n  • Potential executive impersonation detected (confidence: 100.0%)\n  • Contains urgent language requiring immediate action (confidence: 70.0%)\n  • Requests financial information or transactions (confidence: 60.0%)\n\nEmail from: emily.rodriguez@enterprize.org\nSubject: ASAP: Wire Transfer Authorization..."
			},
			"processing_time_ms": null
		},
		{
			"email": {
				"id": "ac064f92-116c-47ab-9d01-936b4ddb65ae",
				"sender": "john.smith@account-alert.net",
				"sender_domain": "account-alert.net",
				"recipient": "unknown@example.com",
				"subject": "CONFIDENTIAL: Emergency Payment Required",
				"body": "Hi,\n\nI need you to process an urgent wire transfer today. Client payment of $21,745 needs to go out immediately.\n\nPlease handle this confidentially and let me know when complete.\n\nThanks,\nRobert Wilson\nCEO",
				"timestamp": "2025-10-29T06:34:00",
				"attachments": [],
				"attachment_count": 0,
				"is_phishing": true,
				"phishing_type": null,
				"confidence": null,
				"created_at": "2025-11-13T10:13:03.378708"
			},
			"rank": 3,
			"threat_score": 0.472,
			"threat_level": "MEDIUM",
			"confidence": 0.56,
			"search_score": 0.0,
			"keyword_matches": [
				"transfer",
				"wire"
			],
			"semantic_similarity": 0.0,
			"features": {
				"urgent_language": 0.7,
				"suspicious_language": 0.0,
				"executive_impersonation": 1.0,
				"new_sender": 0.0,
				"domain_suspicious": 0.0,
				"suspicious_attachment": 0.0,
				"executable_attachment": 0.0,
				"financial_request": 0.6,
				"credential_harvest": 0.0,
				"link_suspicious": 0.0,
				"outside_hours": 0.4,
				"extraction_timestamp": "2025-11-13T10:13:03.382027",
				"overall_risk_score": 0.7545454545454545
			},
			"explanation": "Overview:\n- Threat Level: MEDIUM (0.472)\n- Similarity=0.0 | Confidence: 0.56 | Rank: 3\n\nKey Indicators:\n- executive_impersonation 1.0 – Appears to mimic an executive or authority\n- urgent_language 0.7 – Urgent wording requesting immediate action\n- financial_request 0.6 – Payment / transfer instructions present\n- outside_hours 0.4 – Sent outside typical business hours\n\nRisk Summary:\n- Financial request coupled with urgency signals potential payment fraud; Possible executive impersonation (business email compromise pattern)\n\nRecommended Action:\n- Verify sender authenticity and scrutinize any financial or credential requests.\n\nAnalysis Detail:\n⚠️ HIGH RISK INDICATORS:\n  • Potential executive impersonation detected (confidence: 100.0%)\n  • Contains urgent language requiring immediate action (confidence: 70.0%)\n  • Requests financial information or transactions (confidence: 60.0%)\n\n⚡ MODERATE RISK INDICATORS:\n  • Sent outside typical business hours (confidence: 40.0%)\n\nEmail from: john.smith@account-alert.net\nSubject: CONFIDENTIAL: Emergency Payment Required...",
			"explanation_structured": {
				"overview": {
					"threat_level": "MEDIUM",
					"threat_score": 0.472,
					"similarity_raw": 0.0,
					"similarity_norm": null,
					"confidence": 0.56,
					"rank": 3
				},
				"indicators": [
					{
						"name": "executive_impersonation",
						"score": 1.0,
						"interpretation": "Appears to mimic an executive or authority"
					},
					{
						"name": "urgent_language",
						"score": 0.7,
						"interpretation": "Urgent wording requesting immediate action"
					},
					{
						"name": "financial_request",
						"score": 0.6,
						"interpretation": "Payment / transfer instructions present"
					},
					{
						"name": "outside_hours",
						"score": 0.4,
						"interpretation": "Sent outside typical business hours"
					}
				],
				"risk_summary": "Financial request coupled with urgency signals potential payment fraud; Possible executive impersonation (business email compromise pattern)",
				"recommended_action": "Verify sender authenticity and scrutinize any financial or credential requests.",
				"analysis_detail": "⚠️ HIGH RISK INDICATORS:\n  • Potential executive impersonation detected (confidence: 100.0%)\n  • Contains urgent language requiring immediate action (confidence: 70.0%)\n  • Requests financial information or transactions (confidence: 60.0%)\n\n⚡ MODERATE RISK INDICATORS:\n  • Sent outside typical business hours (confidence: 40.0%)\n\nEmail from: john.smith@account-alert.net\nSubject: CONFIDENTIAL: Emergency Payment Required..."
			},
			"processing_time_ms": null
		},
		{
			"email": {
				"id": "c9e2554b-b07c-4bc0-8b89-31d7090c2143",
				"sender": "jennifer.garcia@security-update.org",
				"sender_domain": "security-update.org",
				"recipient": "unknown@example.com",
				"subject": "Urgent: Client Payment Due Today",
				"body": "Hi,\n\nI need you to process an urgent wire transfer today. Client payment of $35,130 needs to go out immediately.\n\nPlease handle this confidentially and let me know when complete.\n\nThanks,\nSarah Johnson\nCEO",
				"timestamp": "2025-10-24T15:45:00",
				"attachments": [],
				"attachment_count": 0,
				"is_phishing": true,
				"phishing_type": null,
				"confidence": null,
				"created_at": "2025-11-13T10:13:03.379107"
			},
			"rank": 4,
			"threat_score": 0.472,
			"threat_level": "MEDIUM",
			"confidence": 0.56,
			"search_score": 0.0,
			"keyword_matches": [
				"transfer",
				"wire"
			],
			"semantic_similarity": 0.0,
			"features": {
				"urgent_language": 0.7,
				"suspicious_language": 0.0,
				"executive_impersonation": 1.0,
				"new_sender": 0.0,
				"domain_suspicious": 0.0,
				"suspicious_attachment": 0.0,
				"executable_attachment": 0.0,
				"financial_request": 0.7,
				"credential_harvest": 0.0,
				"link_suspicious": 0.0,
				"outside_hours": 0.0,
				"extraction_timestamp": "2025-11-13T10:13:03.382642",
				"overall_risk_score": 0.82
			},
			"explanation": "Overview:\n- Threat Level: MEDIUM (0.472)\n- Similarity=0.0 | Confidence: 0.56 | Rank: 4\n\nKey Indicators:\n- executive_impersonation 1.0 – Appears to mimic an executive or authority\n- urgent_language 0.7 – Urgent wording requesting immediate action\n- financial_request 0.7 – Payment / transfer instructions present\n\nRisk Summary:\n- Financial request coupled with urgency signals potential payment fraud; Possible executive impersonation (business email compromise pattern)\n\nRecommended Action:\n- Verify sender authenticity and scrutinize any financial or credential requests.\n\nAnalysis Detail:\n⚠️ HIGH RISK INDICATORS:\n  • Potential executive impersonation detected (confidence: 100.0%)\n  • Contains urgent language requiring immediate action (confidence: 70.0%)\n  • Requests financial information or transactions (confidence: 70.0%)\n\nEmail from: jennifer.garcia@security-update.org\nSubject: Urgent: Client Payment Due Today...",
			"explanation_structured": {
				"overview": {
					"threat_level": "MEDIUM",
					"threat_score": 0.472,
					"similarity_raw": 0.0,
					"similarity_norm": null,
					"confidence": 0.56,
					"rank": 4
				},
				"indicators": [
					{
						"name": "executive_impersonation",
						"score": 1.0,
						"interpretation": "Appears to mimic an executive or authority"
					},
					{
						"name": "urgent_language",
						"score": 0.7,
						"interpretation": "Urgent wording requesting immediate action"
					},
					{
						"name": "financial_request",
						"score": 0.7,
						"interpretation": "Payment / transfer instructions present"
					}
				],
				"risk_summary": "Financial request coupled with urgency signals potential payment fraud; Possible executive impersonation (business email compromise pattern)",
				"recommended_action": "Verify sender authenticity and scrutinize any financial or credential requests.",
				"analysis_detail": "⚠️ HIGH RISK INDICATORS:\n  • Potential executive impersonation detected (confidence: 100.0%)\n  • Contains urgent language requiring immediate action (confidence: 70.0%)\n  • Requests financial information or transactions (confidence: 70.0%)\n\nEmail from: jennifer.garcia@security-update.org\nSubject: Urgent: Client Payment Due Today..."
			},
			"processing_time_ms": null
		},
		{
			"email": {
				"id": "80ee2902-ca8e-472f-a65d-a6bc774c5168",
				"sender": "michael@enterprize.org",
				"sender_domain": "enterprize.org",
				"recipient": "unknown@example.com",
				"subject": "Urgent: Client Payment Due Today",
				"body": "I'm in meetings all day but need you to process a $41,994 wire transfer ASAP. Same vendor as usual. Handle this quietly.\n\nThanks,\nJennifer Garcia\nCFO",
				"timestamp": "2025-11-01T14:40:00",
				"attachments": [],
				"attachment_count": 0,
				"is_phishing": true,
				"phishing_type": null,
				"confidence": null,
				"created_at": "2025-11-13T10:13:03.379453"
			},
			"rank": 5,
			"threat_score": 0.472,
			"threat_level": "MEDIUM",
			"confidence": 0.56,
			"search_score": 0.0,
			"keyword_matches": [
				"transfer",
				"wire"
			],
			"semantic_similarity": 0.0,
			"features": {
				"urgent_language": 0.7,
				"suspicious_language": 0.0,
				"executive_impersonation": 1.0,
				"new_sender": 0.0,
				"domain_suspicious": 0.0,
				"suspicious_attachment": 0.0,
				"executable_attachment": 0.0,
				"financial_request": 0.7,
				"credential_harvest": 0.0,
				"link_suspicious": 0.0,
				"outside_hours": 0.0,
				"extraction_timestamp": "2025-11-13T10:13:03.383151",
				"overall_risk_score": 0.82
			},
			"explanation": "Overview:\n- Threat Level: MEDIUM (0.472)\n- Similarity=0.0 | Confidence: 0.56 | Rank: 5\n\nKey Indicators:\n- executive_impersonation 1.0 – Appears to mimic an executive or authority\n- urgent_language 0.7 – Urgent wording requesting immediate action\n- financial_request 0.7 – Payment / transfer instructions present\n\nRisk Summary:\n- Financial request coupled with urgency signals potential payment fraud; Possible executive impersonation (business email compromise pattern)\n\nRecommended Action:\n- Verify sender authenticity and scrutinize any financial or credential requests.\n\nAnalysis Detail:\n⚠️ HIGH RISK INDICATORS:\n  • Potential executive impersonation detected (confidence: 100.0%)\n  • Contains urgent language requiring immediate action (confidence: 70.0%)\n  • Requests financial information or transactions (confidence: 70.0%)\n\nEmail from: michael@enterprize.org\nSubject: Urgent: Client Payment Due Today...",
			"explanation_structured": {
				"overview": {
					"threat_level": "MEDIUM",
					"threat_score": 0.472,
					"similarity_raw": 0.0,
					"similarity_norm": null,
					"confidence": 0.56,
					"rank": 5
				},
				"indicators": [
					{
						"name": "executive_impersonation",
						"score": 1.0,
						"interpretation": "Appears to mimic an executive or authority"
					},
					{
						"name": "urgent_language",
						"score": 0.7,
						"interpretation": "Urgent wording requesting immediate action"
					},
					{
						"name": "financial_request",
						"score": 0.7,
						"interpretation": "Payment / transfer instructions present"
					}
				],
				"risk_summary": "Financial request coupled with urgency signals potential payment fraud; Possible executive impersonation (business email compromise pattern)",
				"recommended_action": "Verify sender authenticity and scrutinize any financial or credential requests.",
				"analysis_detail": "⚠️ HIGH RISK INDICATORS:\n  • Potential executive impersonation detected (confidence: 100.0%)\n  • Contains urgent language requiring immediate action (confidence: 70.0%)\n  • Requests financial information or transactions (confidence: 70.0%)\n\nEmail from: michael@enterprize.org\nSubject: Urgent: Client Payment Due Today..."
			},
			"processing_time_ms": null
		}
	],
	"search_metadata": {
		"method": "hybrid",
		"threat_threshold": 0.3,
		"components_used": [
			"retrieval",
			"analysis",
			"scoring",
			"explanation"
		],
		"backend_stats": {
			"total_emails": 150,
			"phishing_emails": 0,
			"legitimate_emails": 150,
			"phishing_percentage": 0.0,
			"index_ready": true,
			"csv_path": "data/emails.csv",
			"chroma_path": "data/chroma",
			"collection_name": "threat_hunting_emails",
			"vector_backend_diagnostics": {
				"pysqlite3_available": true,
				"chroma_import_ok": true,
				"collection_writable": true
			}
		}
	},
	"diagnostics": {
		"request_id": "052003fa-68e4-46bf-a647-c1bd911901d6",
		"query_len": 37,
		"max_results": 5,
		"search_method": "hybrid",
		"pipeline_rebuilt": false,
		"auto_wire_features": false,
		"initial_result_count": 5,
		"processing_ms": 2664,
		"first_similarity": 0.1305626630783081,
		"backend_total_emails": 150
	}
}